{
  "repository": "HungTruong-github/XAI-sports-knowledge-discovery",
  "branch": "Clean",
  "commit_sha": "6a570a4535795f80b806d1efd5f3272eff21ea61",
  "audit_timestamp": "2026-10-23T13:18:09.068625+00:00",
  "environment": {
    "os": "Windows-11-10.0.26200-SP0",
    "python_version": "3.12.0",
    "architecture": "AMD64",
    "packages": {
      "torch": "2.14.0+cpu",
      "torch_geometric": "2.8.0.post1",
      "pandas": "3.0.1",
      "numpy": "2.5.4",
      "scipy": "1.18.1",
      "sklearn": "1.9.1",
      "matplotlib": "3.11.2",
      "seaborn": "0.13.2",
      "yaml": "6.0.3",
      "nbformat": "5.11.1",
      "shap": "0.52.0",
      "xgboost": "3.4.1",
      "lightgbm": "4.7.0"
    },
    "cuda_available": false,
    "cuda_device_name": "CPU only",
    "git": {
      "branch": "Clean",
      "commit_sha": "6a570a4535795f80b806d1efd5f3272eff21ea61",
      "clean_working_tree": true,
      "is_git_repo": true
    },
    "requirements_lock_sha256": "8985ff320b5e903f4e0a71593f214cc9888edcabca68add06e6bca44603479fd"
  },
  "config_hashes": {
    "configs/data.yaml": "4f71e0683123038e77d343fcba30bb58bd42497f3e1da9218ad11ea263785d2b",
    "configs/data_pilot.yaml": "9f6df979afff6b8d160ac6a7620151aecbf8eba822d1796f1eabf08bd0fb0704",
    "configs/graph.yaml": "068a38cdda6b0f8e349eb88f93d34ae3fb5b0976787020b47109ac78212ac0ba",
    "configs/hybrid_centrality.yaml": "4c468f82b645a53d83fc9bf7bc04d8e9a7f6660a86092090b7b407ee6c6c14db",
    "configs/model/baseline_tabular.yaml": "497f740384feb5a4b97ab16903e37b46514c08a912be29a01c9cc22a2571a1fc",
    "configs/model/gatv2.yaml": "eefff6218b25c1643229b98d68df87d2a39a6460fb201e881f8d3fcd045036ad",
    "configs/model/gcn.yaml": "599fe80ac58e7cd51d3748f7382ec1240ddebf5d179181a1131b3854fbe343f8",
    "configs/model/graphsage.yaml": "3ab90dd99d7d2b817b0cee1c4f4e674faab768e2c0f626be360ee467a0602bc2",
    "configs/model/mpnn.yaml": "e1b8533986eaf356259dc4f8b96156d11e5ec10a49e4ed17a388a385e8509488",
    "configs/split.yaml": "2e82c44e092ac5b74a74b0fc28f1e86ff3b3ef3e5c75c161337fc00b6512c8f2",
    "configs/train.yaml": "a22475773b83a12ea7c414b76b418761cdfea2588518385fe9075728c6948d10",
    "configs/xai.yaml": "76ad6a0ae671f746fe381379411f291fb4e62e06c04bb5fc5fd02289de8ed7c4"
  },
  "dataset_fingerprint": "9808330442d6f158233a5534e3adf50f27b97dc86d21c5b3a6d6d75b9f177fac",
  "split_fingerprint": "6774bd48cedb8ad039062acd87d1a73c7a5327127d9ce4d2e137a0110a333ca9",
  "steps": [
    {
      "step": 0,
      "name": "Kiểm toán Môi trường & Khả năng Tái lập",
      "implementation_status": "PASS",
      "verification_status": "PASS",
      "research_approval_status": "APPROVED",
      "implementation_score": 10.0,
      "verification_score": 10.0,
      "overall_step_status": "PASS",
      "evidence_paths": [
        "docs/decisions/0001-quy-tac-gan-nhan.md"
      ],
      "details": "requirements.lock.txt, config hashes POSIX, Git metadata và environment.json đầy đủ.",
      "limitations": [
        "Cần duy trì đồng bộ lockfile khi nâng cấp thư viện."
      ]
    },
    {
      "step": 1,
      "name": "Kiểm toán & Thu thập Dữ liệu",
      "implementation_status": "PASS",
      "verification_status": "PASS",
      "research_approval_status": "APPROVED",
      "implementation_score": 10.0,
      "verification_score": 10.0,
      "overall_step_status": "PASS",
      "evidence_paths": [
        "docs/decisions/0001-quy-tac-gan-nhan.md"
      ],
      "details": "380 trận Premier League 2015/16, 1.313.773 events được kiểm kê độc lập.",
      "limitations": []
    },
    {
      "step": 2,
      "name": "Tiền xử lý, Làm sạch & Gán nhãn",
      "implementation_status": "PASS",
      "verification_status": "PASS",
      "research_approval_status": "PENDING",
      "implementation_score": 9.5,
      "verification_score": 9.5,
      "overall_step_status": "PASS",
      "evidence_paths": [
        "data/raw/2/27",
        "models/official/gatv2_best.pt"
      ],
      "details": "45.365 possession sạch, khóa duy nhất, 16/16 sanity checks đạt.",
      "limitations": [
        "Decision 0001 (quy tắc gán nhãn has_shot) đang ở trạng thái Draft/Pending chờ giảng viên phê duyệt."
      ]
    },
    {
      "step": 3,
      "name": "Xây dựng Đồ thị & Đặc trưng",
      "implementation_status": "PASS",
      "verification_status": "PASS",
      "research_approval_status": "PENDING",
      "implementation_score": 9.5,
      "verification_score": 9.5,
      "overall_step_status": "PASS",
      "evidence_paths": [],
      "details": "45.047 đồ thị (8 node dims, 12 edge dims), cắt trước cú sút đầu, tọa độ kẹp [0,1].",
      "limitations": [
        "Decision 0003 (đơn vị đồ thị & cắt trước cú sút) đang ở trạng thái Draft/Pending.",
        "Vai trò cầu thủ dùng match-dominant role cho framing phân tích hồi cứu (retrospective)."
      ]
    },
    {
      "step": 4,
      "name": "Chia tập Train/Validation/Test theo Trận",
      "implementation_status": "PASS",
      "verification_status": "PASS",
      "research_approval_status": "APPROVED",
      "implementation_score": 10.0,
      "verification_score": 10.0,
      "overall_step_status": "PASS",
      "evidence_paths": [],
      "details": "266 Train / 57 Val / 57 Test (380 trận, giao nhau = 0, 100% độ phủ).",
      "limitations": []
    },
    {
      "step": 5,
      "name": "Huấn luyện GNN & Baselines Multi-seed",
      "implementation_status": "PASS",
      "verification_status": "PASS",
      "research_approval_status": "APPROVED",
      "implementation_score": 10.0,
      "verification_score": 9.5,
      "overall_step_status": "PASS",
      "evidence_paths": [],
      "details": "Đủ 5 seeds cho cả 4 GNN và 3 baselines trong bảng bằng chứng reproducibility; checkpoint tốt nhất lưu tại models/official/.",
      "limitations": [
        "Các tệp checkpoint của từng seed phụ không commit lên Git mà lưu ở kết quả reproducibility."
      ]
    },
    {
      "step": 6,
      "name": "Đánh giá, Thống kê & So sánh Mô hình",
      "implementation_status": "PASS",
      "verification_status": "PASS",
      "research_approval_status": "PENDING",
      "implementation_score": 10.0,
      "verification_score": 10.0,
      "overall_step_status": "PASS",
      "evidence_paths": [],
      "details": "Bảng đối sánh 7 mô hình, mean/std tính từ predictions; KTC 95% và kiểm định bootstrap 10.000 vòng theo trận với hiệu chỉnh Holm.",
      "limitations": [
        "Phương pháp paired cluster bootstrap theo trận và số vòng 10.000 cần báo cáo thống nhất với giảng viên/hội đồng."
      ]
    }
  ],
  "checks": [
    {
      "name": "requirements_lock_present_and_hashed",
      "step": 0,
      "status": "PASS",
      "details": "SHA256: 8985ff320b5e...",
      "expected": true,
      "observed": true,
      "evidence_paths": [
        "requirements.lock.txt"
      ],
      "command_or_source": "audit_steps_0_6",
      "timestamp": "2026-10-23T13:16:46.052578+00:00"
    },
    {
      "name": "config_hashes_posix_compatible",
      "step": 0,
      "status": "PASS",
      "details": "Đã hash 12 configs bằng định dạng POSIX",
      "expected": true,
      "observed": true,
      "evidence_paths": [
        "configs"
      ],
      "command_or_source": "audit_steps_0_6",
      "timestamp": "2026-10-23T13:16:46.052578+00:00"
    },
    {
      "name": "git_provenance_recorded",
      "step": 0,
      "status": "PASS",
      "details": "Branch: Clean | Commit: 6a570a45",
      "expected": true,
      "observed": true,
      "evidence_paths": [],
      "command_or_source": "audit_steps_0_6",
      "timestamp": "2026-10-23T13:16:46.052578+00:00"
    },
    {
      "name": "git_clean_working_tree_verified",
      "step": 0,
      "status": "PASS",
      "details": "Working tree is clean (no uncommitted modifications)",
      "expected": true,
      "observed": true,
      "evidence_paths": [],
      "command_or_source": "audit_steps_0_6",
      "timestamp": "2026-10-23T13:16:46.052578+00:00"
    },
    {
      "name": "collection_summary_tables_exist",
      "step": 1,
      "status": "PASS",
      "details": "Tồn tại collection_report.csv và dataset_inventory.csv",
      "expected": true,
      "observed": true,
      "evidence_paths": [
        "results/tables/official/collection_report.csv",
        "results/tables/official/dataset_inventory.csv"
      ],
      "command_or_source": "audit_steps_0_6",
      "timestamp": "2026-10-23T13:16:46.055639+00:00"
    },
    {
      "name": "raw_match_and_lineup_counts_verified",
      "step": 1,
      "status": "PASS",
      "details": "Tìm thấy 380 trận và 380 file đội hình",
      "expected": 380,
      "observed": 380,
      "evidence_paths": [
        "data/raw/2/27"
      ],
      "command_or_source": "audit_steps_0_6",
      "timestamp": "2026-10-23T13:16:46.089126+00:00"
    },
    {
      "name": "raw_event_count_matches_report",
      "step": 1,
      "status": "PASS",
      "details": "Tổng số event đếm lại độc lập: 1313773 (khớp báo cáo: 1313773)",
      "expected": 1313773,
      "observed": 1313773,
      "evidence_paths": [
        "results/tables/official/collection_report.csv"
      ],
      "command_or_source": "audit_steps_0_6",
      "timestamp": "2026-10-23T13:17:18.652095+00:00"
    },
    {
      "name": "preprocessing_summary_tables_exist",
      "step": 2,
      "status": "PASS",
      "details": "data_pipeline_summary.csv và sanity_checks.csv tồn tại",
      "expected": true,
      "observed": true,
      "evidence_paths": [
        "results/tables/official/data_pipeline_summary.csv",
        "results/tables/official/sanity_checks.csv"
      ],
      "command_or_source": "audit_steps_0_6",
      "timestamp": "2026-10-23T13:17:18.654819+00:00"
    },
    {
      "name": "sanity_checks_all_pass",
      "step": 2,
      "status": "PASS",
      "details": "16/16 sanity checks đạt PASS",
      "expected": 16,
      "observed": 16,
      "evidence_paths": [
        "results/tables/official/sanity_checks.csv"